{
  "summary": "Clients long-poll for catalog and stream events through bounded per-subscription queues.",
  "trigger": "axo.session.subscribe, then repeated axo.session.events.next",
  "steps": [
    {
      "actor": "axod",
      "action": "expire subscriptions not polled for 60 s; reject beyond 64 subscriptions"
    },
    {
      "actor": "axod",
      "action": "create a 128-event queue in catalog or streams scope, optionally for one session"
    },
    {
      "actor": "axod",
      "action": "queue current session snapshots for this subscriber only"
    },
    {
      "actor": "axod",
      "action": "long-poll: wait up to timeoutMs (1 to 20,000), return up to maxEvents (1 to 256)",
      "properties": [
        "waiting polls are futures, not threads"
      ]
    },
    {
      "actor": "axod",
      "action": "on overflow, replace the backlog with a single subscription.lagged marker; client resynchronizes from a fresh list"
    }
  ],
  "anchors": [
    "crates/axo-server/src/session.rs#subscribe",
    "crates/axo-server/src/session.rs#EventBus",
    "crates/axo-ipc/src/event_queue.rs",
    "crates/axo-ipc/src/server.rs",
    "apple/AxoMac/Sources/AxoMac/Sessions/TerminalSessionsModel.swift#resynchronize"
  ]
}
