{
  "summary": "A developer or agent starts/resumes extraction, reads repository files, records model elements and review evidence, and is prompted to continue until coverage and validation pass.",
  "trigger": "Pi tool feynman_extract or /feynman-extract",
  "steps": [
    { "actor": "pi-extension", "action": "create or reuse the extraction coordinator and expose its kickoff instructions", "target": "modeler-adapter" },
    { "actor": "modeler-adapter", "action": "choose bootstrap, resume, or update against HEAD and initialize metadata/coverage scope", "target": "model-library", "protocol": "model-files" },
    { "actor": "modeler-adapter", "action": "track read ranges from successful read-tool results and accept reviews only when full-file evidence and anchors/origin notes satisfy the outcome", "target": "model-library", "protocol": "model-files" },
    { "actor": "modeler-adapter", "action": "on agent completion, recompute coverage and model validity; continue with a reminder, pause after repeated stalls, or measure and finish", "target": "model-library" }
  ],
  "anchors": ["packages/modeler/src/extraction.ts", "packages/modeler/src/evidence.ts", "packages/pi-feynman/src/index.ts", "packages/pi-feynman/skills/modelling/SKILL.md", "package.json"]
}
