{
  "summary": "A browser client drives a host: create/close sessions and shells, set layout, send input, resize.",
  "trigger": "web-app sends axo.remote.* over its client WebSocket",
  "steps": [
    {
      "actor": "web-app",
      "action": "connect client WebSocket with the Axo session cookie",
      "target": "account-do",
      "properties": [
        "≤8 clients per host"
      ]
    },
    {
      "actor": "account-do",
      "action": "record a pending correlation (≤32 per client, ≤128 per host, 10 s deadline)"
    },
    {
      "actor": "account-do",
      "action": "forward the call to the host's socket",
      "target": "axod"
    },
    {
      "actor": "axod",
      "action": "execute against the local catalog",
      "ref": "terminal-input-rpc"
    },
    {
      "actor": "axod",
      "action": "reply over the relay",
      "target": "account-do"
    },
    {
      "actor": "account-do",
      "action": "match reply to pending entry, deliver to client"
    }
  ],
  "anchors": [
    "packages/axo-api-worker/src/axo-host-relay.ts#webSocketMessage",
    "packages/axo-api-worker/src/relay/records.ts",
    "crates/axo-relay/src/relay.rs#remote_request_reply",
    "crates/axo-server/src/session.rs#remote_terminal_input"
  ]
}
