{
  "summary": "Close a Session; replace it first if it was the last of its kind.",
  "trigger": "axo.session.close or axo.remote.session.close; also closing a Pi pane or a Session's last pane",
  "steps": [
    {
      "actor": "axod",
      "action": "if it is the last open Session in its Workspace, create a replacement Workspace session",
      "ref": "create-workspace-session"
    },
    {
      "actor": "axod",
      "action": "if it is the last open standalone Session, create a replacement home session",
      "ref": "create-standalone-session"
    },
    {
      "actor": "axod",
      "action": "archive the Session (reason explicit_close) and drop its Pi activity"
    },
    {
      "actor": "axod",
      "action": "stop its processes on a background thread, outside the catalog mutex",
      "properties": [
        "shell grace 500 ms, Pi grace 3 s, then kill"
      ]
    },
    {
      "actor": "axod",
      "action": "start the replacement's Pi bridge, publish events"
    }
  ],
  "anchors": [
    "crates/axo-server/src/session.rs#close_session",
    "crates/axo-server/src/session.rs#close_shell",
    "crates/axo-pty/src/process.rs#stop_all"
  ]
}
