{
  "summary": "Structured Pi events are copied to a per-session Durable Object and paged by the browser.",
  "trigger": "pi.event forwarded by the relay; browser GET .../sessions/:session/events",
  "steps": [
    {
      "actor": "axod",
      "action": "forward pi.event with sequence and opaque payload",
      "target": "account-do"
    },
    {
      "actor": "account-do",
      "action": "store via AxoSessionDO named (account, host, session)",
      "target": "session-history-do",
      "properties": [
        "≤60,000 bytes per event"
      ]
    },
    {
      "actor": "web-app",
      "action": "page events after a cursor (1 to 50 per page)",
      "target": "account-do"
    },
    {
      "actor": "session-history-do",
      "action": "check ownership binding, return page"
    }
  ],
  "anchors": [
    "packages/axo-api-worker/src/session-history.ts",
    "packages/axo-api-worker/src/auth/account-manager.ts#listPiEvents",
    "packages/axo-web-app/src/pi-history-pane.tsx"
  ]
}
