{
  "summary": "The agent invokes Pi rendering or the root render script; the renderer packages the selected model as JSON into the static application and writes one standalone production HTML artifact.",
  "trigger": "Pi /feynman-render command or bun run render",
  "steps": [
    { "actor": "pi-extension", "action": "resolve output path and request model rendering", "target": "modeler-adapter" },
    { "actor": "modeler-adapter", "action": "invoke Bun build in the renderer package with model and output paths", "target": "model-renderer" },
    { "actor": "model-renderer", "action": "load model, build production Vite bundle, embed model, and copy index HTML to the destination" }
  ],
  "anchors": ["packages/pi-feynman/src/index.ts", "packages/modeler/src/render.ts", "packages/renderer/build.mjs", "packages/renderer/src/main.tsx", "packages/pi-feynman/skills/rendering/SKILL.md", "package.json"]
}
