{
  "summary": "Cloudflare OAuth Authorization Code + PKCE sign-in that yields an Axo web session cookie.",
  "trigger": "GET /api/auth/cloudflare/start",
  "steps": [
    {
      "actor": "api-worker",
      "action": "create state and PKCE verifier in a sealed __Host-axo_oauth cookie (10 min)"
    },
    {
      "actor": "api-worker",
      "action": "redirect to Cloudflare authorization",
      "target": "cloudflare-oauth"
    },
    {
      "actor": "api-worker",
      "action": "on callback: verify state, exchange code, fetch userinfo",
      "target": "cloudflare-oauth",
      "protocol": "http-api"
    },
    {
      "actor": "identity-index-do",
      "action": "map (issuer, subject) to an immutable Axo account ID"
    },
    {
      "actor": "account-do",
      "action": "store session digest, expiry and profile (transaction)"
    },
    {
      "actor": "api-worker",
      "action": "set __Host-axo_session cookie (30 days, HttpOnly, Secure, SameSite=Lax); redirect to /app"
    }
  ],
  "anchors": [
    "packages/axo-api-worker/src/auth/cloudflare.ts",
    "packages/axo-api-worker/src/auth/provider.ts",
    "packages/axo-api-worker/src/auth/account.ts",
    "packages/axo-api-worker/src/auth/account-manager.ts#establishSession",
    "docs/rfds/RFD0013-cloudflare-oauth-and-host-pairing.md"
  ]
}
